{
  "exam": {
    "exam_id": "H20-1",
    "year": 2008,
    "era": "平成",
    "session": 1,
    "subject": "EJU数学"
  },
  "course": 2,
  "track": "science",
  "question_id": "H20-1-IV-1",
  "section": "IV",
  "order": 1,
  "type": "fill_in",
  "original_ja": {
    "text": "a,bを定数，tを正の数とする。xの3次関数 f(x)=4x^3+4ax^2+bx は，x=tで極小値0をとるとする。このとき a,bをtで表すと a=[AB]t, b=[C]t^2 である。曲線y=f(x)とx軸によって囲まれた部分の面積をS1とすると S1=([D]/[E])t^[F] である。一方，曲線y=f(x)の原点における接線の方程式は y=[G]t^2 x であり，この接線とy=f(x)の共有点のx座標は 0 と [H]t である。この接線とy=f(x)によって囲まれた部分の面積をS2とすると S2=([IJ]/[K])t^[L] である。したがって S2/S1 はtによらず一定値[MN]をとる。",
    "placeholders": {
      "A": { "digits": 1 },
      "B": { "digits": 1 },
      "C": { "digits": 1 },
      "D": { "digits": 1 },
      "E": { "digits": 1 },
      "F": { "digits": 1 },
      "G": { "digits": 1 },
      "H": { "digits": 1 },
      "I": { "digits": 1 },
      "J": { "digits": 1 },
      "K": { "digits": 1 },
      "L": { "digits": 1 },
      "M": { "digits": 1 },
      "N": { "digits": 1 }
    },
    "structure": {
      "cubic_extremum_constraints": true,
      "tangent_line": true,
      "area_by_integral": true,
      "ratio_invariant": true
    }
  },
  "answer_ref": {
    "course": 2,
    "section": "IV",
    "q": "1"
  },
  "solution_ref": "solutions/H20-1/course2/H20-1-IV-1.zh.md",
  "pattern_id": "CALC_CUBIC_EXTREMUM_TANGENT_AREA_RATIO",
  "tags": ["微分", "接線", "面積", "極値"],
  "spec_version": "1.4"
}
