{
  "exam": {
    "exam_id": "H22-2",
    "year": 2010,
    "era": "平成",
    "session": 2,
    "subject": "EJU数学"
  },
  "course": 2,
  "track": "science",
  "question_id": "H22-2-I-1",
  "section": "I",
  "order": 1,
  "type": "fill_in",
  "original_ja": {
    "text": "問1　aを正の定数とし，xの2次関数 y=2x^2-4(a+1)x+a^2+6a+4 のグラフをFとする。\n(1) グラフFの頂点の座標をaを用いて表すと (a+[A], -a^2+[B]a+[C]) である。\n(2) グラフFがx軸と接するのは a=[D]+√[E] のときである。\n(3) (2)のグラフをx軸方向に-√3，y軸方向に1だけ平行移動して得られる放物線の方程式は y=[F]x^2-[G]x+[H] である。",
    "formulas": [],
    "structure": {
      "is_divisibility": false,
      "has_parameter_elimination": true,
      "has_case_split": false,
      "has_integer_constraint": false,
      "algebraic_complexity": 2
    }
  },
  "solution": {
    "outline": [],
    "steps": [],
    "symbolic_steps": []
  },
  "answer_ref": {
    "source": "official/course2.json",
    "path": [
      "H22-2",
      "I",
      "Q1"
    ],
    "course": 2,
    "section": "I",
    "q": "Q1"
  },
  "solution_ref": "solutions/H22-2/course2/H22-2-I-1.zh.md",
  "tagging_status": "ok",
  "pattern_id": "QF_DISCRIMINANT_SOLVE_PARAM",
  "blanks": [
    {
      "id": "A",
      "length": 1
    },
    {
      "id": "B",
      "length": 1
    },
    {
      "id": "C",
      "length": 1
    },
    {
      "id": "D",
      "length": 1
    },
    {
      "id": "E",
      "length": 1
    },
    {
      "id": "F",
      "length": 1
    },
    {
      "id": "G",
      "length": 1
    },
    {
      "id": "H",
      "length": 1
    }
  ]
}
