{
  "exam": { "exam_id": "H26-2", "year": 2014, "era": "平成", "session": 2, "subject": "EJU数学" },
  "spec_version": "1.4",
  "course": 2,
  "track": "science",
  "question_id": "H26-2-III-1",
  "section": "III",
  "order": 1,
  "type": "fill_in",
  "pattern_id": "EXP_SUBSTITUTE_MINIMIZE",
  "original_ja": {
    "text": "p>1,q>1とする。方程式 e^{2x}-ae^x+b=0…① において，t=e^xとおくと t^2-at+b=0 は解 log_{q^2}p と log_{p^3}q をもつ。このときaの最小値とそのときの①の解を求めよ。(1) まず b=[A]/[B]，a=([C]/[D])log_q p+([E]/[F])log_p q。(2) p,qがp>1,q>1を満たしながら動くとき，log_p q>[G]。したがってaは最小値 √[H]/[I] を log_p q=√[J]/[K] のときにとる。そのときの①の解は x=-[L]/[M] log_e[N]。",
    "placeholders": {
      "A": { "digits": 1 }, "B": { "digits": 1 },
      "C": { "digits": 1 }, "D": { "digits": 1 },
      "E": { "digits": 1 }, "F": { "digits": 1 },
      "G": { "digits": 1 },
      "H": { "digits": 1 }, "I": { "digits": 1 },
      "J": { "digits": 1 }, "K": { "digits": 1 },
      "L": { "digits": 1 }, "M": { "digits": 1 },
      "N": { "digits": 1 }
    }
  },
  "answer_ref": { "course": 2, "section": "III", "q": "Q1", "sub": null, "group": "A-N" },
  "solution_ref": "solutions/H26-2/course2/H26-2-III-1.zh.md",
  "tagging_status": "ok"
}
