{
  "exam": {
    "exam_id": "H18-1",
    "year": 2006,
    "era": "平成",
    "session": 1,
    "subject": "EJU数学"
  },
  "spec_version": "1.4",
  "course": 2,
  "track": "science",
  "question_id": "H18-1-II-1",
  "section": "II",
  "order": 1,
  "type": "fill_in",
  "pattern_id": "ABS_INTERSECTION_COUNT_PARAM_RANGE",
  "original_ja": {
    "text": "問1 関数 y={|x-2| (x≧0), |x+2| (x<0)} のグラフを l とし，y=ax+1 のグラフを m とする。(1) a=1/4 のとき，l と m の共有点の個数は [A] 個である。a=-1 のとき，l と m の共有点の個数は [B] 個である。(2) l と m が 4 個の共有点をもつような a の値の範囲は -[C]/[D] < a < [E]/[F] である。",
    "formulas": [
      "y=|x-2| (x\\ge 0)",
      "y=|x+2| (x<0)",
      "y=ax+1"
    ],
    "structure": {
      "has_case_split": true,
      "has_parameter_elimination": true,
      "has_integer_constraint": false,
      "algebraic_complexity": 2
    }
  },
  "solution": {
    "outline": [],
    "steps": [],
    "symbolic_steps": []
  },
  "answer_ref": {
    "course": 2,
    "section": "II",
    "q": "Q1",
    "sub": "(all)",
    "group": "A,B,C/D,E/F"
  },
  "solution_ref": "data/solutions/H18-1/course2/H18-1-II-1.zh.md",
  "tagging_status": "ok",
  "blanks": [
    {
      "id": "A",
      "length": 1
    },
    {
      "id": "B",
      "length": 1
    },
    {
      "id": "C",
      "length": 1
    },
    {
      "id": "D",
      "length": 1
    },
    {
      "id": "E",
      "length": 1
    },
    {
      "id": "F",
      "length": 1
    }
  ]
}
