{
  "spec_version": "1.4",
  "exam": {
    "exam_id": "H21-2",
    "year": 2009,
    "era": "平成",
    "session": 2,
    "subject": "EJU数学"
  },
  "course": 2,
  "track": "science",
  "question_id": "H21-2-II-1",
  "section": "II",
  "order": 1,
  "type": "fill_in",
  "original_ja": {
    "text": "等差数列{a_n}と等比数列{b_n}は，どちらも初項が c（a_1=c, b_1=c）で，{a_n}の公差と{b_n}の公比は同じ正の数 d とする。\n(1) a_5=b_3 かつ a_7=b_5 が成り立つとき，c と d の値を求めよう。\n上の条件式を順に c,d を用いて表すと\nc+[A]d=cd^[B],　c+[C]d=cd^[D]\nとなる。この2式から c を消去すると，d=√[E]/[F] が得られ，これより\nc=[GH]√[I]\nも得られる。\n(2) c と d が(1)で求めた値のとき，{b_n}の初項から第2m項までのうち，有理数となる項の和は\n[J]{(( [K]/[L] )^m−[M])}\nである。",
    "formulas": [],
    "structure": {
      "is_divisibility": false,
      "has_parameter_elimination": true,
      "has_case_split": false,
      "has_integer_constraint": false,
      "algebraic_complexity": 3
    }
  },
  "solution": {
    "outline": [
      "等差与等比通项写出条件方程",
      "消元求 d，再代回求 c",
      "判定 b_n 何时为有理数并求和"
    ],
    "steps": [
      {
        "idx": 1,
        "description": "a_n=c+(n-1)d，b_n=cd^{n-1}。由 a5=b3, a7=b5 得两方程。",
        "math": "c+4d=cd^2,\\quad c+6d=cd^4"
      },
      {
        "idx": 2,
        "description": "由两式分别解出 c 并相等，化为关于 d 的方程。令 t=d^2 得 2t^2-3t+1=0，排除 t=1 后得 t=1/2。",
        "math": "d=\\frac{\\sqrt2}{2}"
      },
      {
        "idx": 3,
        "description": "代回 c+4d=cd^2 求 c：c=4d/(d^2-1)=-4\\sqrt2。",
        "math": "c=-4\\sqrt2"
      },
      {
        "idx": 4,
        "description": "b_n=c d^{n-1}，当 n 为偶数时 d^{n-1} 含 √2 的奇次幂与 c 抵消，得到有理数。取 n=2,4,...,2m 求和为等比和。",
        "math": "\\sum_{k=1}^m b_{2k}=8\\left(\\left(\\frac12\\right)^m-1\\right)"
      }
    ],
    "symbolic_steps": []
  },
  "answer_ref": {
    "course": 2,
    "section": "II",
    "q": "Q1",
    "sub": "(1)(2)",
    "group": "A/B/C/D/E/F/GH/I/J/K/L/M"
  },
  "solution_ref": "data/solutions/H21-2/course2/H21-2-II-1.zh.md",
  "tagging_status": "ok",
  "pattern_id": "SEQ_ARITH_GEOM_ELIMINATION",
  "tags": [
    "数列",
    "等差",
    "等比",
    "消元",
    "求和"
  ],
  "blanks": [
    {
      "id": "A",
      "length": 1
    },
    {
      "id": "B",
      "length": 1
    },
    {
      "id": "C",
      "length": 1
    },
    {
      "id": "D",
      "length": 1
    },
    {
      "id": "E",
      "length": 1
    },
    {
      "id": "F",
      "length": 1
    },
    {
      "id": "GH",
      "length": 2
    },
    {
      "id": "I",
      "length": 1
    },
    {
      "id": "J",
      "length": 1
    },
    {
      "id": "K",
      "length": 1
    },
    {
      "id": "L",
      "length": 1
    },
    {
      "id": "M",
      "length": 1
    }
  ]
}
