{
  "exam": { "exam_id": "H30-2", "year": 2018, "era": "平成", "session": 2, "subject": "EJU数学" },
  "spec_version": "1.4",
  "course": 2,
  "track": "science",
  "question_id": "H30-2-I-1",
  "section": "I",
  "order": 1,
  "type": "fill_in",
  "pattern_id": "QF_PARAM_EXTREMA_INTERVAL",
  "original_ja": {
    "text": "2次関数 f(x)=x^2-2(a+1)x+2a^2 の 0≦x≦2 における最大値Mと最小値mについて考える。ただし a は 0≦a≦3。\n(1) 頂点は (a+[A], a^2-[B]a-[C])。\n(2) 0≦a<[D] のとき M=[E], m=[F]。\n[D]≦a≦3 のとき M=[G], m=[H]。\n(3) mが最大：a=[I], m=[J]。mが最小：a=[K], m=[LM]。",
    "placeholders": {
      "A": { "digits": 1 }, "B": { "digits": 1 }, "C": { "digits": 1 },
      "D": { "digits": 1 }, "E": { "digits": 1 }, "F": { "digits": 1 }, "G": { "digits": 1 }, "H": { "digits": 1 },
      "I": { "digits": 1 }, "J": { "digits": 1 }, "K": { "digits": 1 }, "LM": { "digits": 2, "signed": true }
    }
  },
  "answer_ref": { "course": 2, "section": "I", "q": "Q1", "sub": "mix", "group": "ABC/D/EFGH/IJK/LM" },
  "solution_ref": "solutions/H30-2/course2/H30-2-I-1.zh.md",
  "tagging_status": "ok"
}
