{
  "exam": { "exam_id": "H27-1", "year": 2015, "era": "平成", "session": 1, "subject": "EJU数学" },
  "course": 2,
  "track": "science",
  "question_id": "H27-1-IV-1",
  "section": "IV",
  "order": 1,
  "type": "fill_in",
  "pattern_id": "CALC_DERIVATIVE_AREA",
  "original_ja": {
    "text": "f(x)=sin x/(3-2cos x) (0≦x≦π)。(1) f'(x)=([A]cosx-[B])/([C]-[D]cosx)^2。極値をとるxをαとすると cosα=[E]/[F]。(2) 囲まれる部分をx=αで分け，左の面積S1=∫_{[G]/[H]}^{[I]} dt/([J]-[K]t)=[L]/[M] log([N]/[O])。右の面積S2=[P]/2 log[Q]。",
    "formulas": [],
    "placeholders": {
      "A": { "digits": 1 },
      "B": { "digits": 1 },
      "C": { "digits": 1 },
      "D": { "digits": 1 },
      "E": { "digits": 1 },
      "F": { "digits": 1 },
      "G": { "digits": 1 },
      "H": { "digits": 1 },
      "I": { "digits": 1 },
      "J": { "digits": 1 },
      "K": { "digits": 1 },
      "L": { "digits": 1 },
      "M": { "digits": 1 },
      "N": { "digits": 1 },
      "O": { "digits": 1 },
      "P": { "digits": 1 },
      "Q": { "digits": 1 }
    },
    "structure": {
      "is_divisibility": false,
      "has_parameter_elimination": true,
      "has_case_split": false,
      "has_integer_constraint": false,
      "algebraic_complexity": 3
    }
  },
  "solution": {
    "outline": [],
    "steps": [
      { "idx": 1, "description": "商の微分でf'(x)を計算し整理", "math": "f'(x)=\\frac{3\\cos x-2}{(3-2\\cos x)^2}" },
      { "idx": 2, "description": "極値条件からcosαを求める", "math": "3\\cos\\alpha-2=0\\Rightarrow \\cos\\alpha=\\frac23" },
      { "idx": 3, "description": "面積はt=cos x置換で対数積分", "math": "S=\\int \\frac{\\sin x}{3-2\\cos x}dx=\\int \\frac{dt}{3-2t}" },
      { "idx": 4, "description": "S1, S2をそれぞれ評価", "math": "S_1=\\frac12\\ln\\frac53,\\ S_2=\\frac12\\ln 3" }
    ],
    "symbolic_steps": []
  },
  "answer_ref": { "course": 2, "section": "IV", "q": "Q1", "sub": "all", "group": "A/B/C/D/E/F/G/H/I/J/K/L/M/N/O/P/Q" },
  "solution_ref": "solutions/H27-1/course2/H27-1-IV-1.zh.md",
  "tagging_status": "ok"
}
