{
  "exam": {
    "exam_id": "H24-1",
    "year": 2012,
    "era": "平成",
    "session": 1,
    "subject": "EJU数学"
  },
  "course": 2,
  "track": "science",
  "question_id": "H24-1-I-2",
  "section": "I",
  "order": 2,
  "type": "fill_in",
  "original_ja": {
    "text": "問2　多項式 P=x^2+2(a-1)x-8a-8 を考える。(1) aを有理数とする。x=1-\\sqrt2 に対してPの値が有理数になるのは a=[K] のときであり，そのときのPの値は P=[LM] である。(2) x,aを正の整数とする。Pの値が素数になるようなx,aをみつけよう。Pを因数分解して P=(x-[N])(x+[O]a+[P]) を得る。したがって x=[Q] である。さらに，Pの値が素数になるようなaの中で最小のものは a=[R] であり，そのときのPの値は P=[ST] である。",
    "formulas": [
      "P=x^2+2(a-1)x-8a-8",
      "x=1-\\sqrt2",
      "P=(x-[N])(x+[O]a+[P])"
    ],
    "structure": {
      "is_divisibility": false,
      "has_parameter_elimination": true,
      "has_case_split": true,
      "has_integer_constraint": true,
      "algebraic_complexity": 2
    }
  },
  "solution": {
    "outline": [],
    "steps": [],
    "symbolic_steps": []
  },
  "answer_ref": {
    "course": 2,
    "section": "I",
    "q": "Q2",
    "sub": null,
    "group": "K/LM/N/O/P/Q/R/ST"
  },
  "solution_ref": "solutions/H24-1/course2/H24-1-I-2.zh.md",
  "tagging_status": "ok",
  "pattern_id": "ALG_TRANSFORM_SOLVE_PARAM",
  "blanks": [
    {
      "id": "K",
      "length": 1
    },
    {
      "id": "LM",
      "length": 2
    },
    {
      "id": "N",
      "length": 1
    },
    {
      "id": "O",
      "length": 1
    },
    {
      "id": "P",
      "length": 1
    },
    {
      "id": "Q",
      "length": 1
    },
    {
      "id": "R",
      "length": 1
    },
    {
      "id": "ST",
      "length": 2
    }
  ]
}
