{
  "exam": {
    "exam_id": "H24-1",
    "year": 2012,
    "era": "平成",
    "session": 1,
    "subject": "EJU数学"
  },
  "course": 2,
  "track": "science",
  "question_id": "H24-1-II",
  "section": "II",
  "order": 1,
  "type": "fill_in",
  "original_ja": {
    "text": "II　初項から第n項までの和が \\sum_{k=1}^n a_k = n^2+3n である数列{a_n}を考える。(1) a_n=[A]n+[B] である。(2) b_n=n^2-5n-6 である数列{b_n}に対して，b_n<0 となる項は全部で [C]個あり，それらの項の和は -[DE] である。(3) (1),(2)のa_n,b_nに対して \\sum_{k=1}^n \\frac{k^2 b_k}{a_k} = \\frac{1}{[F]} n(n+[G])(n^2-[H]n-[I]) である。",
    "formulas": [
      "\\sum_{k=1}^n a_k=n^2+3n",
      "b_n=n^2-5n-6",
      "\\sum_{k=1}^n \\frac{k^2 b_k}{a_k}=\\frac{1}{[F]} n(n+[G])(n^2-[H]n-[I])"
    ],
    "placeholders": {
      "A": { "digits": 1 },
      "B": { "digits": 1 },
      "C": { "digits": 1 },
      "DE": { "digits": 2 },
      "F": { "digits": 1 },
      "G": { "digits": 1 },
      "H": { "digits": 1 },
      "I": { "digits": 1 }
    },
    "structure": {
      "is_divisibility": false,
      "has_parameter_elimination": false,
      "has_case_split": true,
      "has_integer_constraint": false,
      "algebraic_complexity": 2
    }
  },
  "solution": {
    "outline": [],
    "steps": [],
    "symbolic_steps": []
  },
  "answer_ref": {
    "course": 2,
    "section": "II",
    "q": "Q1",
    "sub": null,
    "group": "A/B/C/DE/F/G/H/I"
  },
  "solution_ref": "solutions/H24-1/course2/H24-1-II.zh.md",
  "tagging_status": "ok",
  "pattern_id": "SEQ_SUM_FORMULA"
}
